<?xml version="1.0" encoding="UTF-8"?>
<!DOCTYPE rules SYSTEM "../rules.dtd">
<?xml-stylesheet type="text/xsl" href="../print.xsl" 
title="Pretty print" ?>
<?xml-stylesheet type="text/css" href="../rules.css" 
title="Easy editing stylesheet" ?>
<!--
Spanish Grammar and Typo Rules for LanguageTool
Copyright (C) 2006 Marcin Miłkowski
$Id: grammar.xml,v 1.7 2009-09-21 10:21:28 milek_pl Exp $
-->
<rules lang="es">
  <category name="misc">
    <!-- from Spanish Wikipedia -->
    <rule id="DE_GRATIS" name="«de gratis» (gratis)">
      <pattern case_sensitive="no" mark_from="0">
        <token>de</token>
        <token>gratis</token>
      </pattern>      
      <message>La forma correcta es decir <suggestion>gratis</suggestion>.</message>
      <short>Forma incorrecta</short>
      <example type="correct">El agua es gratis.</example>
      <example correction="gratis" type="incorrect">El agua es <marker>de gratis</marker>.</example>
    </rule>
  </category>
  <category name="Palabras de difícil ortografía">
    <rule id="AH_INF" name="ah (a)">
      <pattern case_sensitive="no">
        <token>ah</token>
        <token postag="VMN0000"/>
      </pattern>      
      <message>Esta palabra se escribe sin h: <suggestion>a \2</suggestion>.</message>
      <short>Error ortográfico</short>
      <example correction="a hablar" type="incorrect">Voy <marker>ah hablar</marker> con ella.</example>
      <example type="correct">Voy <marker>a hablar</marker> con ella.</example>
    </rule>
    <rule id="VOY_HA_INF" name="ir ha + infinitivo (a)">
      <pattern>
        <token inflected="yes">ir</token>
        <token>ha</token>
        <token postag="VMN0000"/>
      </pattern>
      <message>Esta palabra se escribe sin h: <suggestion>\1 a \3</suggestion>.</message>
      <short>Error ortográfico</short>
      <example correction="Voy a hablar" type="incorrect"><marker>Voy ha hablar</marker> con ella.</example>
      <example type="correct"><marker>Voy a hablar</marker> con ella.</example>
    </rule>
  </category>
  <category name="ortografia">
    <rule id="Y_I" name="y Italia">
      <pattern case_sensitive="no" mark_to="-1">
        <token>y</token>
        <token regexp="yes">^h?[ií].*</token>
      </pattern>
      <message>Cuando precede a palabras que comienzan por i- (o hi-), la conjunción "y" se transforma en "e": <suggestion>e <match no="2"/></suggestion></message>
      <short>Error ortográfico.</short>
      <example correction="e Italia" type="incorrect">Alemania <marker>y Italia</marker> disputarán el torneo.</example>
      <example type="correct">Alemania <marker>e Italia</marker> disputarán el torneo.</example>
    </rule>
  </category>
</rules>
